<?xml version="1.0" encoding="UTF-8"?>
<scientificPaper xmlns="https://github.com/ArpadVS/XML_tim14_2019-Publication"
 xmlns:xsi="http://www.w3.org/2001/XMLSchema-instance"
 xsi:schemaLocation="https://github.com/ArpadVS/XML_tim14_2019-Publication ../xsd/ScientificPaper.xsd">
    <title>This is paper 3</title>
    <authors>
        <author>
            <fullName>Arpad Varga</fullName>
            <institution>
                <name>name0</name>
                <location>
                    <City>City0</City>
                    <State>State0</State>
                    <Country>Country0</Country>
                </location>
            </institution>
            <email>email0</email>
        </author>
        <author>
            <fullName>Nikola Maksimovic</fullName>
            <institution>
                <name>name1</name>
                <location>
                    <City>City1</City>
                    <State>State1</State>
                    <Country>Country1</Country>
                </location>
            </institution>
            <email>email1</email>
        </author>
    </authors>
    <abstract>
        <paragraph>paragraph0</paragraph>
        <paragraph>paragraph1</paragraph>
    </abstract>
    <keywords>
        <keyword>keyword0</keyword>
        <keyword>keyword1</keyword>
    </keywords>
    <content>
        <chapter>
            <title>title1</title>
            <picture>
                <description>description0</description>
                <image>ZGVmYXVsdA==</image>
            </picture>
            <paragraph/>
        </chapter>
        <chapter>
            <title>title2</title>
            <picture>
                <description>description1</description>
                <image>ZGVmYXVsdA==</image>
            </picture>
            <figure>
                <title>title3</title>
                <image>ZGVmYXVsdA==</image>
            </figure>
        </chapter>
    </content>
    <references>
        <reference>
            <refAuthors/>
            <year>0</year>
            <title>title4</title>
            <publisher>
                <institution>institution0</institution>
                <city>city0</city>
            </publisher>
            <webUrl>http://www.oxygenxml.com/</webUrl>
            <refAuthors/>
            <year>0</year>
            <title>title5</title>
            <publisher>
                <institution>institution1</institution>
                <city>city1</city>
            </publisher>
            <webUrl>http://www.oxygenxml.com/</webUrl>
        </reference>
        <reference>
            <refAuthors/>
            <year>0</year>
            <title>title6</title>
            <publisher>
                <institution>institution2</institution>
                <city>city2</city>
            </publisher>
            <webUrl>http://www.oxygenxml.com/</webUrl>
            <refAuthors/>
            <year>0</year>
            <title>title7</title>
            <publisher>
                <institution>institution3</institution>
                <city>city3</city>
            </publisher>
            <webUrl>http://www.oxygenxml.com/</webUrl>
        </reference>
    </references>
</scientificPaper>
